{
  "protocol": "tezuri.operation",
  "version": 1,
  "operationId": "operation:proof-1",
  "kind": "site-proof",
  "state": "succeeded",
  "createdAt": "2026-08-13T15:00:00Z",
  "startedAt": "2026-08-13T15:00:01Z",
  "completedAt": "2026-08-13T15:02:00Z",
  "inputDigest": "sha256:dddddddddddddddddddddddddddddddddddddddddddddddddddddddddddddddd",
  "progress": { "completed": 2, "total": 2, "unit": "commands", "message": "Proof passed." },
  "result": { "runId": "proof:1" }
}
